Datetime,Tweet_Id,Text,Username,Reply_to,Hashtags,original
2023-03-16 05:52:20+00:00,1636243986267488256,"@angel98_amg Hola Ángel, en estos momentos se circula con normalidad en ese tramo. Un saludo.",CercaniasMadrid,1636243122832252928,,"Buenos días@CercaniasMadrid. La C5 sentido Atocha hacia Fuenlabrada - Humanes está funcionando bien? Gracias, un saludo"
2023-03-16 05:51:31+00:00,1636243778947149824,"@Ikatari Hola Héctor, el tren llegará en 5' aproximadamente. Disculpa las molestias.",CercaniasMadrid,1636242664252231680,,@CercaniasMadridBuenos días. ¿Qué ha pasado con el tren previsto para las 6:43 de Fuente de la Mora a Atocha?
2023-03-16 05:51:00+00:00,1636243648315633670,"@barbararranz Hola Bárbara, el tren llegará a las 7:12h aproximadamente. Disculpa la espera, un saludo.",CercaniasMadrid,1636242619045904384,,"@CercaniasMadridhola, pasa el tren por príncipe pio destino las matas a las 07:02 como siempre?"
2023-03-16 05:50:10+00:00,1636243439091081216,"@Andreabluewolf Circulan varios trenes a continuación, Andrea.",CercaniasMadrid,1636242432147718144,,@CercaniasMadridA que hora sale el próximo tren dirección Nuevos Ministerios desde Getafe Centro
2023-03-16 05:45:57+00:00,1636242377856757761,"@Madremi22263364 Buenos días, En breves momentos efectuará su entrada.",CercaniasMadrid,1636241577180905473,,#MadC1#MadC2#MadC7#MadC8#MadC10Por una incidencia en la infraestructura se están produciendo fuertes demoras en los trenes que circulan por el túnel de Recoletos en ambos sentidos.
2023-03-16 05:45:40+00:00,1636242305886613504,"@ElenaSaavedraOl Hola Elena, a las 6:56h aproximadamente llegará el siguiente tren. Disculpa las molestias.",CercaniasMadrid,1636241493601001472,,@CercaniasMadridbuenos días. Algún problema con los trenes destino Alcalá o Guadalajara a su paso por Atocha?? En los indicadores no marca el tiempo de espera y el andén está ya a rebosar
2023-03-16 05:42:30+00:00,1636241511447666688,"@ArtemisaMadrid Hola, en 5' aproximadamente llegará el siguiente tren. Disculpa la espera.",CercaniasMadrid,1636241048346165249,,"@CercaniasMadridpasa algo en la C4 dirección Atocha? Estoy en Getafe central y no pasan trenes, gracias"
2023-03-16 05:42:09+00:00,1636241420334821377,"@Andreabluewolf Hola Andrea, en 5' aproximadamente llegará el siguiente tren. Disculpa la espera.",CercaniasMadrid,1636240484036227072,,@CercaniasMadridA que hora sale el próximo tren dirección Nuevos Ministerios desde Getafe Centro
2023-03-16 05:36:21+00:00,1636239962222870528,"@LadyAstorr Hola, el tren que nos indicas circula con una fuerte demora. Llegará a Pirámides a las 6:48h. Disculpa las molestias.",CercaniasMadrid,1636239462555328512,,
2023-03-16 05:32:05+00:00,1636238889953243136,"@VirginiaRochaC1 Hola Virginia, en 8' aproximadamente llegará el tren. Un saludo y disculpa la espera.",CercaniasMadrid,1636238471005188096,,#MadC1#MadC2#MadC7#MadC8#MadC10Por una incidencia en la infraestructura se están produciendo fuertes demoras en los trenes que circulan por el túnel de Recoletos en ambos sentidos.
2023-03-16 05:16:39+00:00,1636235002525483008,"@Cardemar52Jose Hola, sí, ya se subsanó la incidencia.",CercaniasMadrid,1636234663927619586,,#MadC1#MadC2#MadC7#MadC8#MadC10Por una incidencia en la infraestructura se están produciendo fuertes demoras en los trenes que circulan por el túnel de Recoletos en ambos sentidos.
2023-03-16 05:12:43+00:00,1636234013458280449,"@frechi19 Buenos días, la previsión es que el tren circule con normalidad. Un saludo.",CercaniasMadrid,1636233315823788032,,#MadC1#MadC2#MadC7#MadC8#MadC10Por una incidencia en la infraestructura se están produciendo fuertes demoras en los trenes que circulan por el túnel de Recoletos en ambos sentidos.
2023-03-16 05:05:23+00:00,1636232167066853379,"@Berey98681400 Hola, la previsión es que el tren pase a las 6:21h aproximadamente. Un saludo.",CercaniasMadrid,1636231062203387907,,@CercaniasMadridBuenos días!! Alguna incidencia en el recorrido Valdemoro-Chamartin? El tren de las 6.18h que pasa por Valdemoro va en hora?? Gracias
2023-03-16 04:57:48+00:00,1636230259631702017,@GemitaSurvives Acaba de efectuar su entrada un tren destino Cercedilla.,CercaniasMadrid,1636229357994737664,,@CercaniasMadridse prevé alguna incidencia para el tren programado Alcalá-Atocha a las 05:58?
2023-03-16 04:41:30+00:00,1636226159489761281,"@Spm19751 Buenos días, la previsión es que el tren circule con normalidad. Un saludo.",CercaniasMadrid,1636226062915887104,,@CercaniasMadrid#MadC2¿Me pueden confirmar si el Civis Guadalajara-Fuente de la Mora de las 6:33 va a prestar servicio?
2023-03-16 04:39:57+00:00,1636225770254225409,"@jbaidez777 Buenos días, la previsión es que el tren circule con normalidad. Un saludo.",CercaniasMadrid,1636225362341294082,,@CercaniasMadridBuenos días. Circula hoy el civis con parada en Alcalá a las 6:56?. Gracias
2023-03-16 04:15:13+00:00,1636219544258609158,"@GemitaSurvives Buenos días, la previsión es que el tren circule con normalidad. Un saludo.",CercaniasMadrid,1636150811183939584,,@CercaniasMadridse prevé alguna incidencia para el tren programado Alcalá-Atocha a las 05:58?
2023-03-16 04:09:12+00:00,1636218029183848448,#MadC1 #MadC2 #MadC7 #MadC8 #MadC10 Fue subsanada la incidencia en la infraestructura y los trenes circulan con normalidad a su paso por el túnel de Recoletos.,CercaniasMadrid,1636126444286877696,"['MadC1', 'MadC2', 'MadC7', 'MadC8', 'MadC10']",#MadC1#MadC2#MadC7#MadC8#MadC10Por una incidencia en la infraestructura se están produciendo fuertes demoras en los trenes que circulan por el túnel de Recoletos en ambos sentidos.
