Datetime,Tweet_Id,Text,Username,Reply_to,Hashtags,original
2023-06-03 19:05:24+00:00,1665072208895410176,@bbycheri_ Buenas tardes. 驴Puedes indicarnos tu estaci贸n de origen? Gracias.,CercaniasMadrid,1665070235357945856,,
2023-06-03 17:59:43+00:00,1665055677075582976,@rdgz__ Buenas tardes. El pr贸ximo tren efectuar谩 parada a las 20:13h aproximadamente. Saludos.,CercaniasMadrid,1665054004995321856,,"@CercaniasMadridHola, pr贸ximo tren direcci贸n Atocha en Pinto?? que el de y 49 no ha pasado"
2023-06-03 13:45:50+00:00,1664991787415470081,@JuanAM_MTG Buenas tardes. El tren efectuar谩 parada en 6' aproximadamente. Saludos.,CercaniasMadrid,1664990033382715393,,@CercaniasMadridpr贸ximo tren a Guadalajara que pase por Recoletos?
2023-06-03 13:31:10+00:00,1664988094972526592,@HctorMa35369230 Hola H茅ctor. En 2' aproximadamente efectuar谩 parada tu tren. Saludos.,CercaniasMadrid,1664987680667516931,,"@CercaniasMadridhola, proximo tren por Legan茅s direcci贸n Doce de Octubre? hace mucho que no veo ninguno..."
2023-06-03 13:11:02+00:00,1664983028626489346,"@YQuicios Buenas tardes, Yolanda. Pasamos la informaci贸n al personal responsable, disculpa las molestias ocasionadas. Saludos.",CercaniasMadrid,1664982445563731968,,"@CercaniasMadridHola, Tren saliendo de San Jos茅 Valderas direcci贸n M贸stoles 
Por favor pongan el aire acondicionado es horrible el calor...y ya he cambiado de vag贸n. Gracias"
2023-06-03 11:22:50+00:00,1664955797074223105,"@tpm980 Hola, en ese caso puedes acudir a taquillas de la estaci贸n para que te lo resuelvan, un saludo.",CercaniasMadrid,1664950352288837635,,@CercaniasMadridLa app no deja iniciar sesi贸n..驴como voy a comprar el abono recurrente entonceS?
2023-06-03 10:05:17+00:00,1664936283586658304,"@AsierLain Hola Asier, muchas gracias por tu foto, la adjuntamos a nuestra base de datos para futuras publicaciones etiquet谩ndote, un saludo.",CercaniasMadrid,1664935501256695814,,Buenos d铆as@CercaniasMadridespero que os guste
2023-06-03 09:15:24+00:00,1664923730324103174,"@DanielM45709718 Muchas gracias por escribirnos, ponemos sobre aviso a nuestros compa帽eros de la estaci贸n, un saludo.",CercaniasMadrid,1664923251233923072,,@CercaniasMadridhay un hombre violento en la parte de arriba antes de bajar al anden en la estaci贸n de villalba
2023-06-03 09:12:03+00:00,1664922884169449473,"@DanielM45709718 Hola Daniel, 驴nos puedes describir esa persona y desde cu谩l anden est谩? Un saludo.",CercaniasMadrid,1664920124480974851,,@CercaniasMadridhay un hombre violento en la parte de arriba antes de bajar al anden en la estaci贸n de villalba
2023-06-03 08:23:04+00:00,1664910557525286912,"@chamartinhub Buenos d铆as, muchas gracias por tu foto, la adjuntamos a nuestra base de datos para futuras publicaciones etiquet谩ndote, un saludo y feliz finde.",CercaniasMadrid,1664907253864857600,, Perspectivas @CercaniasMadrid
