Datetime,Tweet_Id,Text,Username,Reply_to,Hashtags,original
2023-05-05 21:42:19+00:00,1654602450337247232,@Vazzzquez_12 En 8' aproximadamente. Un saludo.,CercaniasMadrid,1654601080129323008,,@CercaniasMadridel proximo tren destino parla desde sol??
2023-05-05 20:55:20+00:00,1654590624484450305,"@infisnsd Habitualmente vía 6, no obstante, te recomendamos que prestes atención a megafonía y teleindicadores ante posibles cambios. Un saludo.",CercaniasMadrid,1654588955734450178,,"Hola, ¿en qué vía está el tren dirección Aranjuez? Los luminosos de Atocha están confundiendo a la gente...@CercaniasMadridGracias."
2023-05-05 20:36:19+00:00,1654585837949005824,@NCholodowska En 25' aproximadamente. Un saludo y buena noche.,CercaniasMadrid,1654584969165938692,,@CercaniasMadridpróximo tren destino Guadalajara desde Alcalá?
2023-05-05 20:30:27+00:00,1654584361520332801,"@_angelasdfg Hola, algunos trenes circulan con demora, pero siguiendo su recorrido habitual. Un saludo y disculpa la espera.",CercaniasMadrid,1654574448710766593,,
2023-05-05 20:30:08+00:00,1654584284282331143,"@naataliadiaz2 Hola, el tren efectuó su entrada en la estación al minuto de escribirnos. Un saludo y disculpa la espera.",CercaniasMadrid,1654575257523478529,,"@CercaniasMadridcuando pasa el siguiente tren por nuevos ministerios, dirección aeropuerto"
2023-05-05 20:29:58+00:00,1654584243463307265,"@plaatanoo Hola, el tren efectuó su entrada en la estación al minuto de escribirnos. Un saludo y disculpa la espera.",CercaniasMadrid,1654576043506761728,,
2023-05-05 20:29:19+00:00,1654584076286799872,"@manuel_boyero Hola, comprobamos que el tren realizó una parada técnica debido a necesidades de la circulación. Un saludo y disculpa la espera.",CercaniasMadrid,1654576898129764354,,@CercaniasMadridcercanías Alcobendas con salida de Chamartín a las 21:43 continúa parado en Chamartín con las luces interiores apagadas y los viajeros en su interior. Alguna novedad? Son las 22:00. Gracias.
2023-05-05 20:29:12+00:00,1654584047077670918,"@AsanzCanarias Hola, comprobamos que el tren realizó una parada técnica debido a necesidades de la circulación. Un saludo y disculpa la espera.",CercaniasMadrid,1654577172839899140,,@CercaniasMadridmás de 15 minutos esperando tren en Chamartin destino Atocha. En las vías 6 y 7... hay dos trenes parados y sin salir... cuál sale antes y a qué hora?
2023-05-05 20:28:03+00:00,1654583758991892480,"@ismytuit Hola, comprobamos que el tren realizó una parada técnica debido a necesidades de la circulación. Un saludo y disculpa la espera.",CercaniasMadrid,1654573892537655298,,
2023-05-05 20:27:08+00:00,1654583528372273152,"@jonylugo7 Hola, algunos trenes circulan con demora, pero siguiendo su recorrido habitual. Un saludo y disculpa la espera Jonathan.",CercaniasMadrid,1654581751971295233,,
2023-05-05 20:26:15+00:00,1654583304698441734,@DiatheDiana El tren llegará en 15'. Un saludo y disculpa la espera.,CercaniasMadrid,1654580337752637440,,"@CercaniasMadridllevo más de 25 minutos esperando el tren a Guadalajara desde Vallecas, cuando va a pasar??"
2023-05-05 20:24:59+00:00,1654582988565274631,@Duur__ El tren llegará en 9'. Un saludo y disculpa la espera.,CercaniasMadrid,1654580663259897863,,"@CercaniasMadridhola, que pasa con el tren de Villalba? Estoy en el barrial y no ha pasado el de las 22:11, tampoco aparece en la aplicación el de las 22:40"
2023-05-05 19:43:26+00:00,1654572530261213188,@danybrown Comprobamos que el tren está próximo a efectuar su entrada en la estación. Un saludo.,CercaniasMadrid,1654568608230416385,,@CercaniasMadridtren con destino Chamartin por estación de Vallecas? Tenía que haber pasado alrededor de 15 minutos
2023-05-05 19:19:46+00:00,1654566575364534275,@sin_sangre El tren está próximo a efectuar su salida de Aeropuerto T4. Un saludo y disculpa la espera.,CercaniasMadrid,1654566117820514304,,"¿Talleres didácticos para conocer más sobre el mundo de los trenes y estaciones, visitas guiadas o un viaje en un tren especial? ¡No lo pienses, vente al@M_Ferrocarril!  

🔴 Tarifas especiales para grupos.
Más info:bit.ly/3oBDv9C#EducaTren@ffe_es"
2023-05-05 19:18:56+00:00,1654566366509248515,"@sandryatmgeta83 Hola, comprobamos que el tren con destino Guadalajara está próximo a efectuar su salida de la estación. Un saludo y disculpa la espera.",CercaniasMadrid,1654564386411773953,,@CercaniasMadridestamos en Chamartín esperando tren dirección Atocha que viene con retraso direcc Guadalajara y Alcalá ¿algún problema hay? Gracias
2023-05-05 19:18:03+00:00,1654566142839775232,@_JavierMarin El tren circula con unos minutos de demora debido a que los acumuló en su trayecto anterior. Un saludo y disculpa la espera.,CercaniasMadrid,1654565666064662531,,"Hola, buenas noches@CercaniasMadridestoy en el Barrial y el C7 dirección Las Rozas que pasaba a las 20:57 no ha pasado. No sale ni en las pantallas..."
2023-05-05 19:17:18+00:00,1654565952330117120,@jime_veinte El tren llegará en menos de 5'. Un saludo y disculpa la espera Jimena.,CercaniasMadrid,1654564811773030400,,
2023-05-05 19:15:37+00:00,1654565530315964420,"@yawnseca Hola, en 10' aproximadamente. Un saludo y buena tarde.",CercaniasMadrid,1654564185030656000,,"@CercaniasMadridHola! 

Cuando pasa el próximo tren por Méndez Álvaro hacia Príncipe Pío? 

Gracias!"
2023-05-05 19:13:16+00:00,1654564938457686017,@Carlos_litris El tren llegará en menos de 2'. Un saludo y disculpa la espera.,CercaniasMadrid,1654563223415169026,,"@CercaniasMadrid30 minutos esperando en el aeropuerto, a que hora pasará algún tren ?"
2023-05-05 19:12:34+00:00,1654564762456584193,@jime_veinte ¿En qué estación?,CercaniasMadrid,1654561324205056001,,
2023-05-05 19:12:13+00:00,1654564675936296960,"@alvarophto Hola, el tren llegará en 2'. Un saludo y disculpa la espera.",CercaniasMadrid,1654562138554347520,,"Hola, buenas noches@CercaniasMadridestoy en el Barrial y el C7 dirección Las Rozas que pasaba a las 20:57 no ha pasado. No sale ni en las pantallas..."
2023-05-05 19:11:39+00:00,1654564533275435008,"@carmen26306189 Sí, el tren está próximo a efectuar su salida de la estación. Un saludo.",CercaniasMadrid,1654560292091703296,,"@CercaniasMadridpues aquí sigo esperando el civis de las 20,38 que me han dicho vendría en 10 minutos, han pasado 15 y hasta lo han quitado del panel,así juegan con nuestras vidas"
2023-05-05 18:54:03+00:00,1654560102962036743,"@carmen26306189 Hola, el tren llegará a Chamartín en 5' aproximadamente. Un saludo y disculpa la espera Carmen.",CercaniasMadrid,1654559345831559175,,"@CercaniasMadridpues aquí sigo esperando el civis de las 20,38 que me han dicho vendría en 10 minutos, han pasado 15 y hasta lo han quitado del panel,así juegan con nuestras vidas"
2023-05-05 18:53:19+00:00,1654559919176298503,"@siilrvyk Hola, el tren está próximo a efectuar su salida de la estación. Un saludo y disculpa la espera.",CercaniasMadrid,1654559086267039750,,"@CercaniasMadridhola, cuando sale el tren de Chamartín dirección Guadalajara? Gracias"
2023-05-05 18:48:20+00:00,1654558664055836673,"@miichelleeeeeh Hola Michelle, el siguiente tren llegará en 3' aproximadamente. Un saludo.",CercaniasMadrid,1654557870938046465,,
2023-05-05 18:41:56+00:00,1654557053355012097,"@tramp_net Hola de nuevo, en principio sería en la vía 4, pero eso podría variar porque se asignan las vías al entrar en la estación, por ello te recomendamos que estés atento a megafonía y paneles luminosos, un saludo.",CercaniasMadrid,1654555738184744961,,"Buenos días. 
¿Todavía no has probado nuestro sistema de avisos personalizados? Suscríbete en@CercaniasAvisosy recibe información en tiempo real 🕖 sobre el estado de la circulación de los trenes de Cercanías.#FelizfindesemanaFotografía de@pablorue96¡Muchísimas gracias!"
2023-05-05 18:40:08+00:00,1654556602937081857,"@carmen26306189 Hola está previsto que efectúe salida desde Chamartín con una demora de 10' aproximadamente, un saludo.",CercaniasMadrid,1654555315046608899,,"@CercaniasMadridel civis de las 20,38 dirección Guadalajara va a salir?"
2023-05-05 18:34:49+00:00,1654555263989432320,"@tramp_net Hola, lo tienes en 10' aproximadamente, un saludo.",CercaniasMadrid,1654554721586225152,,"Buenos días. 
¿Todavía no has probado nuestro sistema de avisos personalizados? Suscríbete en@CercaniasAvisosy recibe información en tiempo real 🕖 sobre el estado de la circulación de los trenes de Cercanías.#FelizfindesemanaFotografía de@pablorue96¡Muchísimas gracias!"
2023-05-05 18:10:27+00:00,1654549129350074370,"@mynameispablo3 Hola, tienes el próximo en 2' aproximadamente, un saludo.",CercaniasMadrid,1654548681880748032,,@CercaniasMadridcuando es el próximo tren para Guadalajara desde atocha? Deberían haber pasado ya como dos desde que estoy esperando...
2023-05-05 18:02:17+00:00,1654547074967302146,"@meryy1308__ Hola, el tren llegará en 10' aproximadamente. Un saludo y disculpa la espera María.",CercaniasMadrid,1654546753310412801,,@CercaniasMadrid¿Cuándo llega el tren de las 20.01 a Aeropuerto T4?
2023-05-05 17:48:39+00:00,1654543646681706496,"@moeliax Hola, el tren llegará en 6' aproximadamente. Un saludo.",CercaniasMadrid,1654542762656579585,,"@CercaniasMadridbuenas tardes, cuando pasa el próximo tren por El barrial dirección P.pio?"
2023-05-05 17:44:04+00:00,1654542492472098816,"@DylanGomez95 Hola, tienes el próximo tren en 10' aproximadamente, un saludo.",CercaniasMadrid,1654541554432786432,,"¿Talleres didácticos para conocer más sobre el mundo de los trenes y estaciones, visitas guiadas o un viaje en un tren especial? ¡No lo pienses, vente al@M_Ferrocarril!  

🔴 Tarifas especiales para grupos.
Más info:bit.ly/3oBDv9C#EducaTren@ffe_es"
2023-05-05 17:30:58+00:00,1654539193568174081,"@esthercasadojim De acuerdo, el tren está próximo a efectuar su entrada en la estación. Un saludo y buena tarde.",CercaniasMadrid,1654538022589792257,,"buenas tardes@CercaniasMadrid, la C5 dirección a Fuenlabrada/Humanes muestra retrasos ahora?"
2023-05-05 17:30:44+00:00,1654539136911515649,"@jonasgutf Hola, pasamos aviso al personal responsable, mientras si puedes, intenta cambiarte de coche, pues tienen la climatización individualizada, un saludo.",CercaniasMadrid,1654537770231033856,,
2023-05-05 17:30:30+00:00,1654539076068843521,"@VallbonaJose Hola, el tren ha realizado una parada técnica antes de iniciar su recorrido debido a necesidades de la circulación. Reanudará su marcha en unos instantes. Un saludo y disculpa la espera.",CercaniasMadrid,1654538029908779011,,@CercaniasMadrid¿Se puede saber qué pasa ahora? Voy en el civis Guadalajara - Chamartín y llevamos 10 minutos parados en la entrada a Chamartín
2023-05-05 17:22:56+00:00,1654537172773396482,"@esthercasadojim Hola, si nos indicas qué trayecto vas a realizar podemos ampliarte información.",CercaniasMadrid,1654536358273196044,,"buenas tardes@CercaniasMadrid, la C5 dirección a Fuenlabrada/Humanes muestra retrasos ahora?"
2023-05-05 17:09:04+00:00,1654533685159264260,"@ilomana Hola, ya está solucionada, pero los trenes siguen sufriendo demoras en ambos sentidos, un saludo.",CercaniasMadrid,1654533244405129218,,"Hola@CercaniasMadrid,  hay incidencia en trenes desde Asamblea Recoletos ahora mismo? Gracias."
2023-05-05 17:03:46+00:00,1654532348837257216,"@InesGomSer Hola, el tren llegará en menos de 5'. Un saludo y disculpa la espera Inés.",CercaniasMadrid,1654531435770904576,,@CercaniasMadridllevamos en Chamartin 30 minutos dirección Las Rozas sin ninguna explicación. Cuánto habrá un tren?
2023-05-05 16:59:07+00:00,1654531178022436868,"@mariali33827379 Hola, el tren llegará en 10' aproximadamente. Un saludo y disculpa la espera.",CercaniasMadrid,1654530394249625602,,El tren que tenía que haber pasado por Chamartin destino Escorial ¿cuando pasa?@CercaniasMadrid
2023-05-05 16:58:19+00:00,1654530979527000065,"@JoseTomasPinero Hola, el tren llegará en 13' aproximadamente. Un saludo.",CercaniasMadrid,1654530335466455059,,@CercaniasMadrid@EMTmadrid@metro_madrid@IdiazAyusoAYÚDANOS a mejorar Renfe. Tenemos más de una hora esperando el tren para irnos a nuestras casas y el de “Las Rozas” sigue sin pasar. ¿Qué está pasando? ¿Así es el transporte público? Y no anuncian nada por megafonía.
2023-05-05 16:57:35+00:00,1654530795174756361,"@Carolin26297742 Hola, comprobamos que el tren está próximo a efectuar su entrada en Parla. Un saludo.",CercaniasMadrid,1654528879447375890,,"@CercaniasMadridque pasa otra vez con el tren de Parla, estamos parados en Getafe"
2023-05-05 16:45:45+00:00,1654527816392638474,"@CarlosUte4 Hola, el tren ha realizado una parada técnica antes de iniciar su recorrido debido a necesidades de la circulación. Reanudará su marcha en unos instantes. Un saludo y disculpa la espera Carlos.",CercaniasMadrid,1654527111107837960,,"@CercaniasMadridbuenas tardes. Qué ocurre con el tren Aeropuerto T4-Atocha? Llevamos en el tren desde las 18.00, cuando nos hemos montado ya con retraso en Fuente de la Mora."
2023-05-05 16:38:25+00:00,1654525970727022592,"@Carolin26297742 Hola Carolina, el tren ha realizado una parada técnica antes de iniciar su recorrido debido a necesidades de la circulación. Reanudará su marcha en unos instantes. Un saludo y disculpa la espera.",CercaniasMadrid,1654525332886519808,,@CercaniasMadridEñ tren con destino a Parla está parado en Villaverde Alto y Nadir informe de lo que ocurre
2023-05-05 16:33:45+00:00,1654524796858769411,"@bbycheri_ Hola, si nos facilitas tu trayecto completo, podremos ampliarte información, un saludo.",CercaniasMadrid,1654524289398317057,,@CercaniasMadridque líneas son las que están afectadas exactamente? Desde Atocha funcionan los trenes?
2023-05-05 16:32:42+00:00,1654524531648634880,"@RosarioGalnGar1 Hola, debido a la incidencia en la línea los trenes están circulando con fuertes demoras acumuladas, el tren reanudará su marcha a la mayor brevedad posible. Un saludo y disculpa la espera.",CercaniasMadrid,1654524039937785865,,"@CercaniasMadridmi madre lleva media hora en Nuevos Ministerios destino Atocha parada, no pueden avisar y que se vayan al túnel de Sol ????"
2023-05-05 16:31:40+00:00,1654524270268100614,"@BergelIvan Hola de nuevo, dicho tren circulará con una demora aproximada de 20'. Un saludo y disculpa la espera Iván.",CercaniasMadrid,1654523919611617284,,"@CercaniasMadridBuenas, el civis Guadalajara-Chamartín, que pasa por san fernando sobre las 18:18... pasará? 
0 avisos en la estación. Gracias"
2023-05-05 16:31:31+00:00,1654524235144888340,"@JUANSUA40031371 Hola, debido a la incidencia en la línea los trenes están circulando con fuertes demoras acumuladas y en el caso del Civis se prevee unos 30' de demora, un saludo.",CercaniasMadrid,1654523371944542220,,@CercaniasMadridHola sabéis si va a salir el CIVIS de las 18.38 desde Chamartín a Guadalajara?
2023-05-05 16:29:22+00:00,1654523693446332416,"@Lorena_JimenezM Hola, tienes el próximo tren en 7' aproximadamente, un saludo.",CercaniasMadrid,1654522203277230086,,@CercaniasMadridcuento está previsto que pase el próximo tren desde coslada a atocha?
2023-05-05 16:29:21+00:00,1654523686420873219,"@BergelIvan Hola Iván, dicho tren hoy excepcionalmente no presta servicio. Un saludo.",CercaniasMadrid,1654522484610277376,,"@CercaniasMadridBuenas, el civis Guadalajara-Chamartín, que pasa por san fernando sobre las 18:18... pasará? 
0 avisos en la estación. Gracias"
2023-05-05 16:26:29+00:00,1654522965403287552,"@rmtraviesa1 Hola de nuevo, ya se ha solucionado la incidencia, pero continúan fuertes demoras en ambos sentidos de la línea, un saludo.",CercaniasMadrid,1654521969927127044,,@CercaniasMadridel civis de Chamartín a Atocha funciona o también tiene retenciones?
2023-05-05 16:25:34+00:00,1654522734720712717,"@sariss_s Hola, en breve se retomará la marcha, un saludo.",CercaniasMadrid,1654521851924578305,,"@CercaniasMadridhola! Llevamos más de 20 minutos parados en nuevos ministerios en dirección Alcalá, se sabe cuándo va a retomar la marcha el tren?"
2023-05-05 16:19:03+00:00,1654521097893691395,"@AmarandaK Hola, en estos momentos hay una avería que está produciendo demoras y retenciones, se ampliará más información por megafonía y paneles luminosos, un saludo.",CercaniasMadrid,1654519951355412485,,@CercaniasMadridcuando pasa por la garena el siguiente tren direcion Guadalajara que llevamos más de 20 minutos esperando
2023-05-05 16:18:31+00:00,1654520962241396738,"@jonepavo Hola, se está anunciando por megafonía que está próximo a realizar salida el próximo tren, un saludo.",CercaniasMadrid,1654520104888029184,,"@CercaniasMadridpor favor podéis indicar si saldrán trenes dirección Alcalá desde Atocha.
Estamos con un bebe"
2023-05-05 16:17:01+00:00,1654520586079551488,"@rmtraviesa1 Hola, en estos momentos hay una avería que está produciendo demoras y retenciones, se ampliará más información por megafonía y paneles luminosos, un saludo.",CercaniasMadrid,1654518115424690177,,@CercaniasMadridel civis de Chamartín a Atocha funciona o también tiene retenciones?
2023-05-05 16:16:13+00:00,1654520384048201728,"@Jorgecanetes Hola Jorge, en estos momentos hay una avería que está produciendo demoras y retenciones, se ampliará más información por megafonía y paneles luminosos, un saludo.",CercaniasMadrid,1654517969324498945,,"Hola@CercaniasMadridestoy en#Chamartíny el tren que iba al Escorial a las 17:46 no ha salido.
Cuando hay un tren que vaya alli?"
2023-05-05 16:11:54+00:00,1654519296913965066,"@snta_clauss Hola, en breve se retomará la marcha, en estos momentos está habiendo en ese tramos acumulación de tráfico ferroviario, un saludo.",CercaniasMadrid,1654518399362269188,,"@CercaniasMadridy cuando retoma su recorrido el tren madrid principie Pío, porque lleva 15 minutos parado en nuevos ministerios"
2023-05-05 16:09:50+00:00,1654518774656118784,"@FranMoreno1986 Hola Fran, por la avería de un tren en Entrevías, los trenes están sufriendo demoras y retenciones, un saludo.",CercaniasMadrid,1654517971878813696,,@CercaniasMadridllevamos parados en Nuevos Ministerios dirección Atocha por Recoletos desde hace 10 minutos y no dais ninguna información a los viajeros del tren. ¿Podéis dar detalle?
2023-05-05 16:09:32+00:00,1654518701775806464,"@JavierSastre17 Hola, por la avería de un tren en Entrevías, los trenes están sufriendo demoras y retenciones, un saludo.",CercaniasMadrid,1654518163667558402,,@CercaniasMadrid#MadC3Llevamos más de 10 minutos parados en la estación de recoletos dirección Atocha. Si hubieran informado en la estación de Nuevos Ministerios hubiéramos podido coger otro tren
2023-05-05 16:02:05+00:00,1654516825110069249,"@finnylazo Hola, está previsto el próximo tren en 40' aproximadamente, un saludo.",CercaniasMadrid,1654516003093508096,,"@CercaniasMadrid¿en cuánto pasa el tren a LAS MATAS por la estación de RECOLETOS? (Puede ser C10 o C8, entiendo)."
2023-05-05 15:59:26+00:00,1654516159780093955,"@franciscogedez Hola, por la avería de un tren en la estación de Entrevías, los trenes están realizando paradas técnicas y ralentizando la marcha, se ampliará más información por megafonía y paneles luminosos, un saludo.",CercaniasMadrid,1654515584350953475,,@CercaniasMadridhola. Tenemos más de 15 minutos parados en atocha esperando salga el tren a Alcalá de henares. Pasa algo??
2023-05-05 15:56:42+00:00,1654515471855632387,"@_andrea_ed Hola, por avería de un tren en entrevías, se está reteniendo la marcha, se ampliará más información por megafonía y letreros luminosos, un saludo.",CercaniasMadrid,1654514806605357057,,
2023-05-05 15:52:34+00:00,1654514430057512961,"@jeans_darlenne Hola, en estos momentos se está atendiendo una avería en el propio tren, se ampliará más información por megafonía y letreros luminosos, un saludo.",CercaniasMadrid,1654513882558353417,,@CercaniasMadridpodéis notificarnos que ha pasado en la asamblea de Madrid entrevias con el tren de las 17:30?
2023-05-05 15:52:22+00:00,1654514381793665025,"@jass_286 Hola, en estos momentos se está atendiendo una avería en el propio tren, se ampliará más información por megafonía y letreros luminosos, un saludo.",CercaniasMadrid,1654513259553202181,,@CercaniasMadridQué está pasando en la estación de Entrevías? Se va a reanudar el servicio próximamente?
2023-05-05 15:38:32+00:00,1654510898046816258,"@javivi_rubio Hola, está a punto de entrar en la estación, un saludo.",CercaniasMadrid,1654510340808294411,,@CercaniasMadridcuanto queda para que pase por Atocha un tren dirección Sol?? Llevamos 15 minut esperando....
2023-05-05 15:35:02+00:00,1654510018257993729,"@EmmanuelVisual Hola Emmanuel, el tren ha realizado una parada técnica antes de iniciar su recorrido debido a necesidades de la circulación. Reanudará su marcha en unos instantes. Un saludo y disculpa la espera.",CercaniasMadrid,1654509570478186497,,@CercaniasMadridamiguitos pueden decir que la pasa al tren dirección atocha? Está detenido en medio de la nada antes de llegar a el pozo ñ?
2023-05-05 15:25:56+00:00,1654507728709058560,"@Strongnow Hola, puedes reclamar o en taquillas de la estación, o a través del siguiente enlace:
https://t.co/AQme2Xcvu5
Un saludo.",CercaniasMadrid,1654507321794478083,,@CercaniasMadridqué hay que hacer para poner una queja formal?
2023-05-05 15:18:51+00:00,1654505948281544706,"@rcarterasw Hola, el tren está próximo a efectuar su salida de la estación. Un saludo y disculpa la espera.",CercaniasMadrid,1654505662179581952,,@CercaniasMadridque pasa con el tren de nuevos ministerios a Parla que debería salir a y 10?
2023-05-05 15:16:51+00:00,1654505444767924225,"@Strongnow Hola, el tren está próximo a efectuar su salida de Nuevos Ministerios.",CercaniasMadrid,1654504979120390144,,@CercaniasMadridpróximo tren en sol dirección parla?
2023-05-05 15:07:02+00:00,1654502971491663872,"@meryother Hola, pasamos aviso al personal responsable, mientras si puedes, intenta cambiar de coche, pues tienen la climatización individualizada, un saludo.",CercaniasMadrid,1654502288772288519,,"@CercaniasMadriden el primer vagón del tren que supuestamente va a Guadalajara y está llegando a Atocha, podrían poner el aire un poco más fuerte...me gustaría llegar a mi casa después de todo. Gracias"
2023-05-05 14:54:28+00:00,1654499808315338753,"@Claraaqua7 Hola Clara, en 5' aproximadamente llegará el siguiente tren con destino Atocha-Príncipe Pío. Un saludo y disculpa la espera.",CercaniasMadrid,1654499309746831360,,"@CercaniasMadridque pasa con los trenes que van hacia atocha desde chamartin? No está saliendo ninguno y yo al menos, llevo esperando media hora…"
2023-05-05 14:53:02+00:00,1654499448645382144,"@cipriansk1 Hola, pasamos aviso para que se revise el correcto funcionamiento de los sistemas informativos de dicho tren. Un saludo y gracias por informarnos.",CercaniasMadrid,1654498283316736000,,@CercaniasMadridOye. Qué está pasando con el tren que acaba de salir de Atocha? Por fuera y por dentro del tren pone Alcalá de Henares y están anunciando por la megafonía del tren que la siguiente parada es Mendez Alvaro.
2023-05-05 14:42:16+00:00,1654496739296985094,"@Eliiile Hola, el tren llegará en 15' aproximadamente. Un saludo y disculpa la espera.",CercaniasMadrid,1654496194003910660,,
2023-05-05 14:25:33+00:00,1654492531772538882,"@evitacucharita Hola, el tren llegará sobre las 16:43h. Un saludo.",CercaniasMadrid,1654490917112279044,,@CercaniasMadridBuenas tardes.¿El civis chamartin-guadalajara de las 16:40 funciona con normalidad?
2023-05-05 14:25:29+00:00,1654492514768789511,"@Yolanda_Garcia1 Hola, tienes el siguiente tren en 4' aproximadamente, un saludo.",CercaniasMadrid,1654490859662917644,,"@CercaniasMadridBuenas tardes, el próximo tren que pasa por Santa Eugenia dirección Alcalá a que hora pasa?"
2023-05-05 14:20:52+00:00,1654491354842513409,"@i_loeches Hola, el tren lleva demora acumulada y está previsto que salga en unos 10' aproximadamente, un saludo.",CercaniasMadrid,1654490549829660672,,@CercaniasMadridel civis Guadalajara de las 16:08 lo habéis cancelado? Es que ya van 10 minutos de retraso y sin noticias
2023-05-05 14:14:28+00:00,1654489742581420033,"@_Asison2476_ Hola, está próximo a efectuar su entrada el siguiente tren. Un saludo.",CercaniasMadrid,1654489378666758150,,"@CercaniasMadridhola, próximo tren desde Cantoblanco hacía tres cantos? Gracias"
2023-05-05 14:05:46+00:00,1654487552873701380,"@Kit87222955 Hola, el siguiente tren saldrá en 5' aproximadamente. Un saludo.",CercaniasMadrid,1654487214909210628,,@CercaniasMadridcuando pasa el proximo  tren a parla desde nuevos ministerios? Sólo están pasando sin servicio. Gracias
2023-05-05 13:54:35+00:00,1654484738076180481,@rakshancia A las 16:05h aproximadamente llegará el siguiente tren a Villalba y después iniciará recorrido hacia Príncipe Pío.,CercaniasMadrid,1654484289776394243,,@CercaniasMadridcuando se espera el próximo tren de Villalba a príncipe pío? Gracias
2023-05-05 13:52:21+00:00,1654484177805361152,"@Madrid_7896 Hola María, en 8' aproximadamente. No hay vía asignada, por lo que, por favor, permanece atenta a los sistemas de información de la estación. Un saludo.",CercaniasMadrid,1654483774766297090,,"@CercaniasMadrid@CercaniasAvisosa qué hora y desde qué andén pasa el próximo tren a Aeropuerto desde Chamartin? Espero información, nos habéis dejado tirados en el andén a los que veníamos de Atocha."
2023-05-05 13:49:49+00:00,1654483538459209728,"@DxI_AMxOND Hola, puedes consultar los horarios en este enlace: https://t.co/QWmkt46JSl
También puedes hacerlo en nuestra app. Un saludo.",CercaniasMadrid,1654483143439646725,,@CercaniasMadridhay algún tren desde atocha que pare en sol saliendo cerca de las 18:30?
