Datetime,Tweet_Id,Text,Username,Reply_to,Hashtags,original
2023-04-07 18:17:41+00:00,1644404090359758848,"@marianoparla Hola Mariano, el procedimiento que te han indicado es correcto. Disculpa las molestias. Un saludo.",CercaniasMadrid,1644401337176670213,,"Hola@CercaniasMadrid. Tengo un abono recurrente “impreso” en la tarjeta personalizada (el QR deja de funcionar). He perdido la tarjeta y quiero reimprimir mi abono. Me indican que no es posible, que me compre uno nuevo y me hacen pagar un sencillo. Quien me puede resolver esto"
2023-04-07 17:01:50+00:00,1644385004351258653,"@rafafdez70 Hola Rafael, las vías se asignan nada más llegar a la estación, por ello te recomendamos que esté atento a megafonía y a paneles luminosos, un saludo.",CercaniasMadrid,1644384336559341587,,"@CercaniasMadridpor qué vía sale el tren de las 19.04, destino Aranjuez en la estación de Atocha?"
2023-04-07 16:06:21+00:00,1644371040007593987,"@belg97023 Buenas tardes, en estos momentos, el tren efectuó salida de la estación y salió de la vía 5. Un saludo.",CercaniasMadrid,1644367117540532227,,@CercaniasMadridhola cuál es la vía que va a arajuez desde atocha
2023-04-07 14:48:23+00:00,1644351420265644032,"@Kopnicc Hola, funcionan en su horario programado. Un saludo.",CercaniasMadrid,1644350286998257664,,"#MadC4#MadC5Debido a una incidencia en la infraestructura de la estación de Villaverde Alto, los trenes están sufriendo retenciones y demoras en ambos sentidos."
2023-04-07 14:02:06+00:00,1644339770636509186,"¡No tires tu tarjeta +Renfe&amp;tú! ❌ Es reutilizable. Utilízala para cargar tu abono gratuito del segundo cuatrimestre de 2023.

Si no la tienes, cómprala en taquilla o en las máquinas autoventa, valida tu viaje al inicio y final, y guárdala para usarla siempre en Cercanías 🚉. https://t.co/vW555DoMoJ",CercaniasMadrid,None,,
2023-04-07 14:02:06+00:00,1644339770636509186,"¡No tires tu tarjeta +Renfe&amp;tú! ❌ Es reutilizable. Utilízala para cargar tu abono gratuito del segundo cuatrimestre de 2023.

Si no la tienes, cómprala en taquilla o en las máquinas autoventa, valida tu viaje al inicio y final, y guárdala para usarla siempre en Cercanías 🚉. https://t.co/vW555DoMoJ",CercaniasMadrid,None,,
2023-04-07 13:22:45+00:00,1644329867905835010,"@gami74011729 Hola, sí, los trenes circulan en su horario programado para el día de hoy. Un saludo.",CercaniasMadrid,1644328638685298688,,@CercaniasMadridcirculan con normalidad los trenes#MadC4de Alcobendas dirección Chamartín?
2023-04-07 10:38:51+00:00,1644288621887868929,"@alxgrca_ Buenos días, comprobamos que a las 12:50h aproximadamente efectuará su entrada en dicha estación. Un saludo.",CercaniasMadrid,1644288066503294976,,Hola@CercaniasMadridcuando es el próximo tren destino Humanes/Fuenlabrada que pasa por laguna
2023-04-07 09:55:23+00:00,1644277683621175298,"@Yoi_Walker Buenos días, los trenes con destino El Escorial efectúan parada en la estación de Atocha, puedes consultar los horarios y las frecuencias de los trenes en el siguiente enlace: https://t.co/QWmkt46JSl
Un saludo.",CercaniasMadrid,1644276960682442752,,"📢 Recuerda:  
Obras en la infraestructura entre Nuevos Ministerios y Chamartín por el túnel de Sol.

🔴 Líneas afectadas: C3, C3a, C4, C4a y C4b. Resto de líneas realizan su recorrido habitual.

➡️ Plan Alternativo de Transporte:bit.ly/3H1rf8Z#ChamartínMásCerca"
2023-04-07 09:07:15+00:00,1644265571322671107,@alba_mei Comprobamos que dicho tren efectuará su entrada en dicha estación a las 11:29h aproximadamente. Un saludo.,CercaniasMadrid,1644265044232876032,,"@CercaniasMadridcuando va a pasar un tren hacia el Escorial por Atocha? Es que no me fio de los horarios oficiales, que luego nunca cumplís"
2023-04-07 08:49:46+00:00,1644261168658128899,"@alba_mei Hola, comprobamos que dicho tren circula con su frecuencia de paso habitual. Un saludo.",CercaniasMadrid,1644258661970202624,,"@CercaniasMadridcuando va a pasar un tren hacia el Escorial por Atocha? Es que no me fio de los horarios oficiales, que luego nunca cumplís"
2023-04-07 07:44:35+00:00,1644244767134425088,#MadC4 #MadC5 Los trenes van recuperando sus frecuencias de paso progresivamente.,CercaniasMadrid,1644219045019803655,"['MadC4', 'MadC5']","#MadC4#MadC5Debido a una incidencia en la infraestructura de la estación de Villaverde Alto, los trenes están sufriendo retenciones y demoras en ambos sentidos."
2023-04-07 06:51:31+00:00,1644231411300290561,"@_patricia97 Buenos días, comprobamos que hay un tren próximo a efectuar su salida de la estación de Móstoles-El Soto. Un saludo.",CercaniasMadrid,1644230961264033796,,"@CercaniasMadridbuenos días, cuando pasará el tren desde mostoles central hasta atocha?"
2023-04-07 06:02:23+00:00,1644219045019803655,"#MadC4 #MadC5 Subsanada la incidencia en la estación de Villaverde Alto, los trenes circulan con demoras acumuladas.",CercaniasMadrid,1644191706701545472,"['MadC4', 'MadC5']","#MadC4#MadC5Debido a una incidencia en la infraestructura de la estación de Villaverde Alto, los trenes están sufriendo retenciones y demoras en ambos sentidos."
2023-04-07 06:01:51+00:00,1644218913771724801,"@maria33720978 Hola, comprobamos que en 5' aproximadamente efectuará su entrada en dicha estación. Un saludo.",CercaniasMadrid,1644217691283025920,,"#MadC4#MadC5Debido a una incidencia en la infraestructura de la estación de Villaverde Alto, los trenes están sufriendo retenciones y demoras en ambos sentidos."
2023-04-07 05:43:39+00:00,1644214330852884480,"@focus44030068 Buenos días, en 3' aproximadamente efectuará su entrada en dicha estación. Un saludo.",CercaniasMadrid,1644213760649752576,,"#MadC4#MadC5Debido a una incidencia en la infraestructura de la estación de Villaverde Alto, los trenes están sufriendo retenciones y demoras en ambos sentidos."
2023-04-07 05:02:08+00:00,1644203885559513088,"@sin_sangre Hola, en 6' aproximadamente efectuará su entrada en dicha estación. Un saludo.",CercaniasMadrid,1644202032167886849,,"#MadC4#MadC5Debido a una incidencia en la infraestructura de la estación de Villaverde Alto, los trenes están sufriendo retenciones y demoras en ambos sentidos."
2023-04-07 04:35:40+00:00,1644197225403146242,"@Natsuki_brishit Buenos días, por una incidencia en la infraestructura en la estación de Villaverde Alto, los trenes están sufriendo retenciones y demoras en ambos sentidos. Un saludo.",CercaniasMadrid,1644196563810496512,,@CercaniasMadridpor que no nos informan por megafonía de c4 parla. ¿QUE OCURRE?
2023-04-07 04:23:33+00:00,1644194173698932739,"@Floriin15 Hola, te recomendamos que estés atento a la megafonía y teleindicadores de la propia estación. Un saludo.",CercaniasMadrid,1644193061138755584,,
2023-04-07 04:19:47+00:00,1644193228390891522,"@Albertt_Sam Hola, nos comunican que por una incidencia en la infraestructura los trenes están sufriendo retenciones y demoras en ambos sentidos. Un saludo.",CercaniasMadrid,1644186719049089031,,"Buenas@CercaniasMadrid. Estoy en Villaverde Alto, en el tren de la C-5 y llevamos parados casi 10 minutos…qué ha pasado?? Gracias"
2023-04-07 04:13:45+00:00,1644191706701545472,"#MadC4 #MadC5 Debido a una incidencia en la infraestructura de la estación de Villaverde Alto, los trenes están sufriendo retenciones y demoras en ambos sentidos.",CercaniasMadrid,None,"['MadC4', 'MadC5']",
2023-04-07 04:13:45+00:00,1644191706701545472,"#MadC4 #MadC5 Debido a una incidencia en la infraestructura de la estación de Villaverde Alto, los trenes están sufriendo retenciones y demoras en ambos sentidos.",CercaniasMadrid,None,"['MadC4', 'MadC5']",
