Datetime,Tweet_Id,Text,Username,Reply_to,Hashtags,original
2023-04-15 19:43:13+00:00,1647324720595890177,"@alejand40742902 Hola Alejandro, puedes consultar horarios y frecuencias en el siguiente enlace:
https://t.co/QWmkt46JSl
Un saludo.",CercaniasMadrid,1647322432494088193,,@CercaniasMadridaque hora pasa el ultimo tren cercedilla guadalajara
2023-04-15 19:08:01+00:00,1647315859755417606,"@mariade94 Hola, en estos momentos algunos trenes est치n circulando con demoras, si nos facilitas tu trayecto completo, podremos ampliarte informaci칩n, un saludo.",CercaniasMadrid,1647314914015432704,,@CercaniasMadridhay alguna incidencia en la C-5?
2023-04-15 18:27:23+00:00,1647305634096857090,"@Fundacionfriend Hola V칤ctor, en el tramo que nos comentas, los trenes est치n circulando sin incidencias, un saludo.",CercaniasMadrid,1647303934678007811,,@CercaniasMadridHola buenas tardes una pregunta como va la C5 desde Atocha a Fuenlabrada Central
2023-04-15 18:17:28+00:00,1647303139324751872,"@Mitchelmarshal2 Hola, en breve va efectuar salida desde la estaci칩n un tren, un saludo.",CercaniasMadrid,1647302564122165250,,"@CercaniasMadridque pasa con el tren de atocha a Aranjuez,???? Retrasos aver칤as ??? Que pasa hoy ?"
2023-04-15 18:04:38+00:00,1647299909358436353,"@littlemoix Hola, es por la alta concentraci칩n de tr치fico ferroviario en el tramo de Fuente de la Mora a Nuevos Ministerios, en breve se retomar치 la marcha, disculpa la espera, un saludo.",CercaniasMadrid,1647298897046282241,,"Hola@CercaniasMadrid, llevamos 10 minutos parados antes de Fuente de la Mora (direcci칩n Villalba), no nos dan informaci칩n, 쯤u칠 ocurre?"
2023-04-15 17:26:03+00:00,1647290201272664064,"@teddyhaechan Hola, hay un tren a punto de entrar en la estaci칩n en 5' aproximadamente, un saludo.",CercaniasMadrid,1647288706175213568,,@CercaniasMadrida que hora pasa el siguiente a aranjuez en atocha? Se supone que pasa uno a y 21 ahora pero no han avisado nada :(
2023-04-15 14:04:32+00:00,1647239488706424832,"@VictoriaSoleto No tenemos tiempo estimado de ello, se ampliar치 m치s informaci칩n por megafon칤a y paneles luminosos, un saludo.",CercaniasMadrid,1647238810491580417,,"Tren de la c5 estacionado en 4 vientos, direcci칩n mostoles. Llevamos un buen rato parados, que pasa?@CercaniasMadrid"
2023-04-15 14:00:43+00:00,1647238526918950916,"@Lua_sd3 Hola, debido a la presencia de una persona en la zona de v칤as y su invasi칩n de las mismas en la estaci칩n de Alcorc칩n, se ha detenido el tr치fico ferroviario moment치neamente en ambos sentidos entre las estaciones de Cuatro Vientos y M칩stoles El Soto.",CercaniasMadrid,1647237806106857478,,@CercaniasMadridpor qu칠 estamos parados en Cuatro Vientos?
2023-04-15 14:00:35+00:00,1647238492752150534,"@VictoriaSoleto Hola, debido a la presencia de una persona en la zona de v칤as y su invasi칩n de las mismas en la estaci칩n de Alcorc칩n, se ha detenido el tr치fico ferroviario moment치neamente en ambos sentidos entre las estaciones de Cuatro Vientos y M칩stoles El Soto.",CercaniasMadrid,1647237812125614082,,"Tren de la c5 estacionado en 4 vientos, direcci칩n mostoles. Llevamos un buen rato parados, que pasa?@CercaniasMadrid"
2023-04-15 13:26:21+00:00,1647229877383225345,"@anyxvf Hola Ana, est치n circulando los trenes de forma habitual, un saludo.",CercaniasMadrid,1647221774088585217,,@CercaniasMadridbuenas hay alg칰n tipo de incidencia en la C4 o circula con normalidad?
2023-04-15 11:46:09+00:00,1647204660606824451,"@OscarRibagorda Hola Oscar, los trenes est치n circulando con leves demoras con sus trayectos habituales. Un saludos.",CercaniasMadrid,1647204134863470592,,@CercaniasMadridbuenas tardes!! Hay alguna incidencia en la l칤nea C5?? Gracias!!
2023-04-15 11:30:19+00:00,1647200677981036545,"@jeenra Hola Jes칰s, hemos comprobado que el tren efectuar치 entrada en la estaci칩n en 10' aproximadamente. Disculpa la espera. Un saludo.",CercaniasMadrid,1647199858929926145,,"@CercaniasMadridBuenas tardes, el tren con direcci칩n a Atocha que tendr칤a que haber salido a las 13.26 de Valdemoro, hay alguna posibilidad que funcione? No tenemos ninguna informaci칩n. Gracias."
2023-04-15 11:28:56+00:00,1647200330495426560,"@PaulaRomero_A Hola Paula, puedes consultar las frecuencias y los horarios de los trenes en el siguiente enlace: https://t.co/QWmkt46JSl. Un saludo.",CercaniasMadrid,1647199848373030913,,@CercaniasMadridcada cuanto pasa la c5 hoy por Fuenlabrada central? Llevamos esperando 25 minutos y NADA.
2023-04-15 11:17:46+00:00,1647197516667006977,"@TaamaraSGarcia Hola Tamara, el tren efectuar치 entrada en la estaci칩n en 6' aproximadamente. Un saludo.",CercaniasMadrid,1647196530695184384,,@CercaniasMadridhola de nuevo. El tren de las 13:11 de Aranjuez direcci칩n atocha a qu칠 hora tiene pensado efectuar su entrada y su salida de la estaci칩n? Gracias
2023-04-15 11:08:41+00:00,1647195231295533056,"@bici_javier Hola, hemos comprobado que el tren acaba de efectuar entrada en la estaci칩n. Un saludo.",CercaniasMadrid,1647194723168186370,,@CercaniasMadridc칩mo va el tren hacia fuenla en Villaverde alto...?
2023-04-15 11:00:18+00:00,1647193123825565697,"@marigon377 Hola de nuevo, hemos comprobado que efectu칩 salida el tren de la estaci칩n. Un saludo.",CercaniasMadrid,1647191387295580160,,@CercaniasMadridse puede saber que pasa hoy en la C5? Llevo 15 min. esperando y ahora pone que pasar치 en 9 min. Esto es una verg칲enza 25 min!!
2023-04-15 10:50:48+00:00,1647190733743439872,"@marigon377 Hola, 쯅os puedes indicar estaci칩n de origen y destino para ampliarte m치s informaci칩n?. Un saludo.",CercaniasMadrid,1647189536542261251,,@CercaniasMadridse puede saber que pasa hoy en la C5? Llevo 15 min. esperando y ahora pone que pasar치 en 9 min. Esto es una verg칲enza 25 min!!
2023-04-15 09:22:16+00:00,1647168453084696578,"@Zuzugrp Hola de nuevo Susan, hemos comprado que el tren acaba de efectuar salida de la estaci칩n. Disculpa la espera. Un saludo.",CercaniasMadrid,1647167384053248002,,
2023-04-15 09:16:18+00:00,1647166949623840769,"@Zuzugrp Hola Susan, 쯅os puedes indicar estaci칩n de destino para ampliarte m치s informaci칩n. Un saludo.",CercaniasMadrid,1647165992190242819,,
2023-04-15 08:41:58+00:00,1647158309278064643,"@TaamaraSGarcia Hola Tamara, hemos comprobado que el pr칩ximo tren saldr치 de la estaci칩n de Aranjuez en 10' aproximadamente. Un saludo.",CercaniasMadrid,1647157383154786305,,@CercaniasMadridbuenos d칤as. Hay alg칰n tipo de demoras en la l칤nea C-3 destino atocha desde Aranjuez? Gracias
2023-04-15 08:15:30+00:00,1647151648161275905,"@redstar23 Buenos d칤as Oscar, hemos comprobado que el tren ha efectuado entrada en la estaci칩n de M칩stoles. Disculpa la espera. Un saludo.",CercaniasMadrid,1647150466919436289,,"@CercaniasMadrid쯔lg칰n problema en la l칤nea C-5? Llevamos m치s de 20 minutos de espera en M칩stoles central sentido Atocha, con un tren parado en sentido al Soto."
2023-04-15 08:14:19+00:00,1647151350084685825,"@raquelcoco18 Buenos d칤as Raquel, hemos comprobado que el tren acaba de efectuar entrada en la estaci칩n. Un saludo.",CercaniasMadrid,1647150535487946752,,"춰Descubre Tierra de Gigantes! 游뱅 

Viaja en el Tren de los Molinos al lugar donde Don Quijote se enfrent칩 a los gigantes, Campo de Criptana: ida y vuelta 游댃 con salida desde Madrid-Chamart칤n y Atocha Cercan칤as.

游늰 Pr칩xima salida: s치bado, 29 de abril.
游녤bit.ly/401o4EK"
2023-04-15 07:42:43+00:00,1647143401303732224,"@luamadriz76 Hola, est칠 previsto que el tren efect칰e entrada en la estaci칩n en 7' aproximadamente. Un saludo.",CercaniasMadrid,1647142562912763904,,@CercaniasMadridbuenos dis funciona el tren direcci칩n atocha desde Aranjuez ?
2023-04-15 07:20:16+00:00,1647137750204796930,@noegs25 Gracias a ti por avisarnos. Un saludo y qu칠 tengas buen d칤a.,CercaniasMadrid,1647137099018059776,,@CercaniasMadridel tren que acaba de salir de Fuenlabrada uno de los vagones no tiene luz y est치 oscuro completamente.
2023-04-15 07:08:14+00:00,1647134722131210241,"@noegs25 Hola de nuevo Noelia, damos aviso al personal correspondiente. Gracias por avisarnos. Un saludo.",CercaniasMadrid,1647134230831325185,,@CercaniasMadridel tren que acaba de salir de Fuenlabrada uno de los vagones no tiene luz y est치 oscuro completamente.
2023-04-15 07:07:34+00:00,1647134554765811714,"@PabloCst93 Hola Pablo, hemos comprobado que el tren efectuar치 entrada en la estaci칩n en 2' aproximadamente. Un saludo.",CercaniasMadrid,1647134194626183168,,
2023-04-15 07:05:34+00:00,1647134049415069698,"@noegs25 Buenos d칤as, 쯅os puedes indicar composici칩n, y altura del tren?. Un saludo.",CercaniasMadrid,1647132917196357633,,@CercaniasMadridel tren que acaba de salir de Fuenlabrada uno de los vagones no tiene luz y est치 oscuro completamente.
2023-04-15 06:06:15+00:00,1647119123183280128,"@doldola21 Hola de nuevo, hemos comprobado que el tren ya efectu칩 entrada en la estaci칩n. Un saludo.",CercaniasMadrid,1647118382108377088,,"@CercaniasMadridBuenos d칤as, son las 7:45 y el tren de 7 :38 desde Ciempozuelos con destino Atocha no ha pasado. Alg칰n problema? Cu치ndo pasar치? Gracias"
2023-04-15 05:52:23+00:00,1647115632708579331,"@doldola21 Buenos d칤as, el tren efectuar치 entrada en la estaci칩n en breve. Disculpa las molestias. Un saludo.",CercaniasMadrid,1647114109660348416,,"@CercaniasMadridBuenos d칤as, son las 7:45 y el tren de 7 :38 desde Ciempozuelos con destino Atocha no ha pasado. Alg칰n problema? Cu치ndo pasar치? Gracias"
2023-04-15 05:35:55+00:00,1647111490204319745,"@Mina10625236 Buenos d칤as Mina, hemos comprobado que el tren tiene previsto su entrada en la estaci칩n en 7' aproximadamente. Un saludo.",CercaniasMadrid,1647110862082129920,,@CercaniasMadridel tren la serna-atocha de las 7.32 no ha pasado y no tiene anunciados retrasos ni incidencias. A qu칠 hora pasar치? Gracias
2023-04-15 05:06:52+00:00,1647104179914125313,"@Dani_GarciaMnz Buenos d칤as, hemos comprobado que el tren efectuar치 entrada en la estaci칩n  en 2' aproximadamente. Un saludo.",CercaniasMadrid,1647103642300739586,,@CercaniasMadridPr칩ximo tren direcci칩n M칩stoles que pase por La Serna ?
2023-04-15 04:11:47+00:00,1647090316837629955,"@luizzz02_ Hola Luis, hemos comprobado que el tren ha efectuado salida de la estaci칩n. Disculpa la espera. Un saludo.",CercaniasMadrid,1647088852736131072,,"@CercaniasMadridestamos parados entre las 치guilas y justa freire, qu칠 pasa??"
